{
  "$id": "https://brachybench.local/schema/task.schema.json",
  "$schema": "https://json-schema.org/draft/2020-12/schema",
  "title": "BrachyBench Task Schema v1 (DESIGN §7)",
  "type": "object",
  "required": [
    "schema_version", "id", "track", "layers", "construct",
    "cost_class", "power_role", "clinical_intent",
    "fixture", "protocol", "oracle", "scoring", "anti_gaming", "provenance"
  ],
  "additionalProperties": false,
  "$defs": {
    "evidence_keys": {
      "type": "object",
      "required": [
        "case_id", "planning_id", "planning_version", "geometry_revision",
        "roi_id", "metric_name", "unit", "dose_definition",
        "source_artifact_id", "computed_at", "valid_for_revision"
      ],
      "additionalProperties": false,
      "properties": {
        "case_id": {"type": "string"},
        "planning_id": {"type": "string"},
        "planning_version": {"type": "integer", "minimum": 0},
        "geometry_revision": {"type": "integer", "minimum": 0},
        "roi_id": {"type": "string"},
        "metric_name": {"type": "string"},
        "unit": {"type": "string"},
        "dose_definition": {"type": "string"},
        "source_artifact_id": {"type": "string"},
        "computed_at": {"type": "string"},
        "valid_for_revision": {"type": "integer", "minimum": 0}
      }
    },
    "budget": {
      "type": "object",
      "required": ["wall_clock_s", "turns", "tool_calls"],
      "additionalProperties": false,
      "properties": {
        "wall_clock_s": {"type": "number", "minimum": 0},
        "turns": {"type": "integer", "minimum": 0},
        "tool_calls": {"type": "integer", "minimum": 0}
      }
    }
  },
  "properties": {
    "schema_version": {"const": "1.0"},
    "id": {"type": "string", "pattern": "^[A-Za-z][A-Za-z0-9]*(-[A-Za-z0-9]+)*-[0-9]+$"},
    "track": {"enum": ["A","B","C","D1","D2","D3","E","F","G","H","I","J","K","L","M"]},
    "layers": {"type": "array", "items": {"enum": ["L0","L1","L2","L3","L4","L5"]}, "minItems": 1},
    "comparability": {"type": "array", "items": {"enum": ["alpha","beta","gamma"]}},
    "construct": {"type": "string"},
    "cost_class": {"enum": ["state_only", "light_compute", "heavy_compute"]},
    "power_role": {"enum": ["primary", "secondary", "exploratory", "safety_gate"]},

    "clinical_intent": {"type": "string"},

    "fixture": {
      "type": "object",
      "required": ["case_family", "setup_script", "initial_state_hash"],
      "additionalProperties": false,
      "properties": {
        "case_family": {"type": "string"},
        "setup_script": {"type": "string"},
        "initial_state_hash": {"type": "string", "pattern": "^sha256:"}
      }
    },

    "unit": {
      "type": "object",
      "required": ["kind", "group_type"],
      "additionalProperties": false,
      "properties": {
        "kind": {"enum": ["task_scenario", "expression"]},
        "group_type": {"enum": ["G-EQ", "G-CT", "G-CTX"]},
        "contrast_family_id": {"type": "string"}
      }
    },

    "protocol": {
      "type": "object",
      "required": ["mode", "turns", "budget"],
      "additionalProperties": false,
      "properties": {
        "mode": {"enum": ["single_turn", "multi_turn", "dual_path"]},
        "turns": {
          "type": "array", "minItems": 1,
          "items": {
            "type": "object",
            "required": ["role", "text"],
            "properties": {
              "role": {"enum": ["user", "assistant", "system"]},
              "text": {"type": "string"},
              "lang": {"enum": ["zh", "en"]},
              "setup": {"type": "string"}
            }
          }
        },
        "ui_counterpart": {"type": ["array", "null"]},
        "budget": {"$ref": "#/$defs/budget"},
        "allowed_intermediates": {"type": "array", "items": {"type": "string"}},
        "audit_required": {"type": "boolean"},
        "n_runs": {"type": "integer", "minimum": 1}
      }
    },

    "oracle": {
      "type": "object",
      "required": ["kind", "check"],
      "additionalProperties": false,
      "properties": {
        "kind": {"enum": ["program", "guideline", "rubric", "expert", "judge"]},
        "artifact": {"type": "string"},
        "check": {"type": "string"},
        "constraint_class": {"enum": ["invariant", "transition", "postcondition", "none"]},
        "expect": {},
        "tolerance": {"type": ["object", "null"]},
        "forbidden_predicates": {"type": "array", "items": {"type": "string", "pattern": "^[a-z][a-z0-9_]*$"}},
        "predicate": {"type": "string", "pattern": "^[a-z][a-z0-9_]*$"},
        "persistence": {"enum": ["terminal", "any"]},
        "also_assert": {
          "type": "array",
          "items": {
            "type": "object",
            "required": ["check"],
            "properties": {
              "check": {"enum": ["pred", "claim_matches_state", "metric_provenance", "dose_additivity"]},
              "predicate": {"type": "string", "pattern": "^[a-z][a-z0-9_]*$"},
              "claim": {"type": "string"},
              "require_evidence_keys": {"type": "boolean"},
              "evidence_keys": {"$ref": "#/$defs/evidence_keys"}
            }
          }
        },
        "assist_only": {"type": "boolean"},
        "independent_check": {"type": "boolean"},
        "evidence_keys": {"type": "array", "items": {"type": "string"}},
        "gold": {"type": ["string", "null"]},
        "config": {
          "type": ["object", "null"],
          "description": "generator config incl. the probed mechanism (N7 L2/L3)",
          "properties": {"mechanism": {"type": "string"}}
        }
      }
    },

    "scoring": {
      "type": "object",
      "required": ["primary_metric"],
      "additionalProperties": false,
      "properties": {
        "primary_metric": {"type": "string"},
        "gate_refs": {"type": "array", "items": {"type": "string"}},
        "weight": {"type": "number", "minimum": 0},
        "difficulty_target": {"enum": ["easy", "medium", "hard"]},
        "calibrated": {"type": "boolean", "description": "O3/O4/O5 passed calibration (§8.5); enables the subordinate score"},
        "coverage_floor": {"type": "number", "minimum": 0, "maximum": 1, "description": "subordinate-score N/A floor (doc §5)"},
        "assertions": {
          "description": "per-assertion dimension/weight override for the subordinate score (doc §4)",
          "type": "array",
          "items": {
            "type": "object",
            "required": ["check"],
            "additionalProperties": false,
            "properties": {
              "check": {"type": "string"},
              "dimension": {"enum": ["correctness","evidence","process","reproducibility","communication","efficiency","memory","robustness","safety"]},
              "weight": {"type": "number", "minimum": 0}
            }
          }
        }
      }
    },

    "anti_gaming": {
      "type": "object",
      "required": ["paraphrase_group"],
      "additionalProperties": false,
      "properties": {
        "paraphrase_group": {"type": "string"},
        "hidden": {"type": "boolean"},
        "generation_seed": {"type": "integer"},
        "canary_class": {"type": ["string", "null"]},
        "behavioral_probes": {"type": "array", "items": {"type": "string"}},
        "contrast_family_id": {"type": "string"}
      }
    },

    "provenance": {
      "type": "object",
      "required": ["source", "reviewers", "authored_on"],
      "additionalProperties": false,
      "properties": {
        "source": {"enum": ["expert_authored","real_case_derived","generated","audit_derived","legacy_migrated"]},
        "derived_from": {"type": "string"},
        "guideline_ref": {"type": ["string", "null"]},
        "reviewers": {"type": "array", "items": {"type": "string"}, "minItems": 1},
        "authored_on": {"type": "string", "pattern": "^[0-9]{4}-[0-9]{2}-[0-9]{2}$"},
        "deprecated": {
          "type": ["object", "null"],
          "required": ["since", "reason", "replaced_by"],
          "properties": {
            "since": {"type": "string"},
            "reason": {"type": "string"},
            "replaced_by": {"type": "string"}
          }
        }
      }
    }
  }
}
