{
  "schema_version": "1.0",
  "id": "BRAIN-DECIDE-051",
  "track": "A",
  "layers": [
    "L3",
    "L4"
  ],
  "comparability": [
    "alpha",
    "beta"
  ],
  "construct": "planner_tool_selection_extra_2",
  "cost_class": "state_only",
  "power_role": "primary",
  "clinical_intent": "Planner tool selection must use real IDs within the toolset; unknown IDs must be dropped rather than substituted.",
  "fixture": {
    "case_family": "synth/memory_case",
    "setup_script": "fixtures/setup/memory_case.py",
    "initial_state_hash": "sha256:b5db22baf264552a1992522773785d1af6a75924b0dafc14fc2aa20a95a3f4ac"
  },
  "unit": {
    "kind": "task_scenario",
    "group_type": "G-CT",
    "contrast_family_id": "brain/deciders/unknown_tool_dropped"
  },
  "protocol": {
    "mode": "single_turn",
    "turns": [
      {
        "role": "user",
        "text": "Planner tool selection must use real IDs within the toolset; unknown IDs must be dropped rather than substituted.",
        "lang": "en"
      }
    ],
    "ui_counterpart": null,
    "budget": {
      "wall_clock_s": 60,
      "turns": 1,
      "tool_calls": 6
    },
    "allowed_intermediates": [],
    "audit_required": false,
    "n_runs": 5
  },
  "oracle": {
    "kind": "program",
    "check": "retrieval_at_k",
    "constraint_class": "none",
    "expect": null,
    "tolerance": null,
    "assist_only": false,
    "independent_check": true,
    "evidence_keys": [],
    "gold": null
  },
  "scoring": {
    "primary_metric": "retrieval_at_k_pass",
    "gate_refs": [],
    "weight": 1.0,
    "difficulty_target": "medium"
  },
  "anti_gaming": {
    "paraphrase_group": "BRAIN-DECIDE-051-P01",
    "hidden": false,
    "generation_seed": 6702,
    "canary_class": null,
    "behavioral_probes": [],
    "contrast_family_id": "brain/deciders/unknown_tool_dropped"
  },
  "provenance": {
    "source": "audit_derived",
    "derived_from": "brain/deciders/planner_decider.py:130-153",
    "guideline_ref": null,
    "reviewers": [
      "auto"
    ],
    "authored_on": "2026-10-01",
    "deprecated": null
  }
}
