{
  "anti_gaming": {
    "behavioral_probes": [],
    "canary_class": null,
    "contrast_family_id": "physics/dose_additivity",
    "generation_seed": 20260929,
    "hidden": false,
    "paraphrase_group": "PHYS-dose_additivity-017"
  },
  "clinical_intent": "dose_additivity physics-boundary probe dose_additivity-017: Compute the dose and confirm that the cumulative dose equals the sum of the per-seed contributions within 1e-4 relative tolerance.",
  "comparability": [
    "alpha",
    "beta"
  ],
  "construct": "physics_boundary.dose_additivity",
  "cost_class": "state_only",
  "fixture": {
    "case_family": "synth/physics/dose_additivity/dose_additivity-017",
    "initial_state_hash": "sha256:e3c9f2b25ac4a7cf619f77b3665df5c368d70a4c6d67c3659f2ac0c2f253ec46",
    "setup_script": "fixtures/physics/dose_additivity-017.json"
  },
  "id": "A-DOSEADDITIVITY-017",
  "layers": [
    "L3"
  ],
  "oracle": {
    "assist_only": false,
    "check": "dose_additivity",
    "config": {
      "mechanism": "dose/additivity_n1"
    },
    "constraint_class": "none",
    "evidence_keys": [],
    "expect": {
      "codes": [],
      "verdict": "pass"
    },
    "gold": null,
    "independent_check": true,
    "kind": "program",
    "tolerance": null
  },
  "power_role": "exploratory",
  "protocol": {
    "allowed_intermediates": [],
    "audit_required": false,
    "budget": {
      "tool_calls": 2,
      "turns": 1,
      "wall_clock_s": 20
    },
    "mode": "single_turn",
    "n_runs": 3,
    "turns": [
      {
        "lang": "en",
        "role": "user",
        "text": "Compute the dose and confirm that the cumulative dose equals the sum of the per-seed contributions within 1e-4 relative tolerance."
      }
    ],
    "ui_counterpart": null
  },
  "provenance": {
    "authored_on": "2026-09-30",
    "deprecated": null,
    "derived_from": "tools/gen_physics_fixtures.py (analytic oracle)",
    "guideline_ref": null,
    "reviewers": [
      "auto-verifier"
    ],
    "source": "generated"
  },
  "schema_version": "1.0",
  "scoring": {
    "difficulty_target": "easy",
    "gate_refs": [],
    "primary_metric": "oracle_verdict_match",
    "weight": 1.0
  },
  "track": "A",
  "unit": {
    "contrast_family_id": "physics/dose_additivity",
    "group_type": "G-CT",
    "kind": "task_scenario"
  }
}
