{
  "schema_version": "1.0",
  "id": "I-MEDIUMCOMPLEXITY-0080",
  "track": "I",
  "layers": [
    "L3"
  ],
  "comparability": [
    "alpha",
    "beta"
  ],
  "construct": "medium_complexity.open_intent",
  "cost_class": "state_only",
  "power_role": "exploratory",
  "clinical_intent": "Design a prospective randomized controlled trial comparing MRI-guided adaptive brachytherapy versus CT-based brachytherapy for locally advanced cervical cancer. Include the primary endpoint, secondary endpoints, sample size calculation based on published local control rates, stratification factors, and the statistical analysis plan.",
  "fixture": {
    "case_family": "legacy/medium_complexity",
    "setup_script": "fixtures/setup/prostate_s02_full_pipeline.py",
    "initial_state_hash": "sha256:38eabca0a6bcb5062deac0e5645e8bf52d9e5f51cdd0f137f824f4509461ada3"
  },
  "unit": {
    "kind": "task_scenario",
    "group_type": "G-EQ",
    "contrast_family_id": "legacy/medium_complexity"
  },
  "protocol": {
    "mode": "single_turn",
    "turns": [
      {
        "role": "user",
        "text": "Design a prospective randomized controlled trial comparing MRI-guided adaptive brachytherapy versus CT-based brachytherapy for locally advanced cervical cancer. Include the primary endpoint, secondary endpoints, sample size calculation based on published local control rates, stratification factors, and the statistical analysis plan.",
        "lang": "en"
      }
    ],
    "ui_counterpart": null,
    "budget": {
      "wall_clock_s": 60,
      "turns": 1,
      "tool_calls": 4
    },
    "allowed_intermediates": [],
    "audit_required": false,
    "n_runs": 3
  },
  "oracle": {
    "kind": "judge",
    "check": "judge_rubric",
    "constraint_class": "none",
    "expect": null,
    "tolerance": null,
    "assist_only": true,
    "independent_check": false,
    "evidence_keys": [],
    "gold": "rubric:medium_complexity"
  },
  "scoring": {
    "primary_metric": "rubric_met",
    "gate_refs": [],
    "weight": 0.5,
    "difficulty_target": "medium"
  },
  "anti_gaming": {
    "paraphrase_group": "OPEN-MEDIUMCOMPLEXITY-0080",
    "hidden": false,
    "generation_seed": 2026,
    "canary_class": null,
    "behavioral_probes": [
      "en"
    ],
    "contrast_family_id": "legacy/medium_complexity"
  },
  "provenance": {
    "source": "legacy_migrated",
    "derived_from": "legacy:v1/23_medium_complexity.json#Q0655",
    "guideline_ref": null,
    "reviewers": [
      "auto"
    ],
    "authored_on": "2026-09-30",
    "deprecated": null
  }
}
