{
  "schema_version": "1.0",
  "id": "PLAN2-REINF-007",
  "track": "A",
  "layers": [
    "L3",
    "L4"
  ],
  "comparability": [
    "alpha",
    "beta"
  ],
  "construct": "rl_objective_reproducible",
  "cost_class": "state_only",
  "power_role": "primary",
  "clinical_intent": "pancreas the final objective value and coverage of the same RL plan must be reproducible.",
  "fixture": {
    "case_family": "synth/pancreas_p03_pipeline",
    "setup_script": "fixtures/setup/pancreas_p03_pipeline.py",
    "initial_state_hash": "sha256:bb54b53f5ceec64b975a9a01c3b7c6d5e8293a7f3b940a64bc6d922c30607a7b"
  },
  "unit": {
    "kind": "task_scenario",
    "group_type": "G-CT",
    "contrast_family_id": "plans/reinforcement/objective_determinism"
  },
  "protocol": {
    "mode": "single_turn",
    "turns": [
      {
        "role": "user",
        "text": "pancreas the final objective value and coverage of the same RL plan must be reproducible.",
        "lang": "en"
      }
    ],
    "ui_counterpart": null,
    "budget": {
      "wall_clock_s": 60,
      "turns": 1,
      "tool_calls": 6
    },
    "allowed_intermediates": [],
    "audit_required": false,
    "n_runs": 5
  },
  "oracle": {
    "kind": "program",
    "check": "semantic_equivalence",
    "constraint_class": "none",
    "expect": null,
    "tolerance": null,
    "assist_only": false,
    "independent_check": true,
    "evidence_keys": [],
    "gold": null
  },
  "scoring": {
    "primary_metric": "semantic_equivalence_pass",
    "gate_refs": [],
    "weight": 1.0,
    "difficulty_target": "medium"
  },
  "anti_gaming": {
    "paraphrase_group": "PLAN2-REINF-007-P01",
    "hidden": false,
    "generation_seed": 2416,
    "canary_class": null,
    "behavioral_probes": [],
    "contrast_family_id": "plans/reinforcement/objective_determinism"
  },
  "provenance": {
    "source": "audit_derived",
    "derived_from": "plans/reinforcement.py:1102-1151 evaluate_plan_objective; oracles/artifacts.py:349-382",
    "guideline_ref": null,
    "reviewers": [
      "auto"
    ],
    "authored_on": "2026-10-01",
    "deprecated": null
  }
}
