{
  "schema_version": "1.0",
  "id": "REPCTX-046",
  "track": "A",
  "layers": [
    "L2",
    "L4"
  ],
  "comparability": [
    "alpha",
    "beta"
  ],
  "construct": "report_context_expression_invariance",
  "cost_class": "state_only",
  "power_role": "primary",
  "clinical_intent": "Phrasing changes in the report context must not alter the site determination (pancreatic).",
  "fixture": {
    "case_family": "synth/memory_case",
    "setup_script": "fixtures/setup/memory_case.py",
    "initial_state_hash": "sha256:b5db22baf264552a1992522773785d1af6a75924b0dafc14fc2aa20a95a3f4ac"
  },
  "unit": {
    "kind": "task_scenario",
    "group_type": "G-EQ",
    "contrast_family_id": "report/context/paraphrase"
  },
  "protocol": {
    "mode": "single_turn",
    "turns": [
      {
        "role": "user",
        "text": "Phrasing changes in the report context must not alter the site determination (pancreatic).",
        "lang": "en"
      }
    ],
    "ui_counterpart": null,
    "budget": {
      "wall_clock_s": 60,
      "turns": 1,
      "tool_calls": 6
    },
    "allowed_intermediates": [],
    "audit_required": false,
    "n_runs": 5
  },
  "oracle": {
    "kind": "program",
    "check": "paraphrase_invariance",
    "constraint_class": "none",
    "expect": null,
    "tolerance": null,
    "assist_only": false,
    "independent_check": true,
    "evidence_keys": [],
    "gold": null
  },
  "scoring": {
    "primary_metric": "paraphrase_invariance_pass",
    "gate_refs": [],
    "weight": 1.0,
    "difficulty_target": "medium"
  },
  "anti_gaming": {
    "paraphrase_group": "REPCTX-EQ-10",
    "hidden": false,
    "generation_seed": 13209,
    "canary_class": null,
    "behavioral_probes": [
      "phrasing_swap"
    ],
    "contrast_family_id": "report/context/paraphrase"
  },
  "provenance": {
    "source": "audit_derived",
    "derived_from": "tool_factory/report_context.py:22-67 (verified source metadata)",
    "guideline_ref": null,
    "reviewers": [
      "auto"
    ],
    "authored_on": "2026-10-01",
    "deprecated": null
  }
}
