{
  "schema_version": "1.0",
  "id": "SKILLS-MD-029",
  "track": "L",
  "layers": [
    "L3",
    "L4"
  ],
  "comparability": [
    "alpha",
    "beta"
  ],
  "construct": "markdown_skill_expression_robust",
  "cost_class": "state_only",
  "power_role": "primary",
  "clinical_intent": "Chinese/English and alias expressions must all retrieve the ['standard_planning'] skill.",
  "fixture": {
    "case_family": "synth/interop_case",
    "setup_script": "fixtures/setup/interop_case.py",
    "initial_state_hash": "sha256:5580992734c65dddb22edba5969a1955389deab388d8c25a38c79110fe4dc002"
  },
  "unit": {
    "kind": "task_scenario",
    "group_type": "G-EQ",
    "contrast_family_id": "L/markdown_loader/expression"
  },
  "protocol": {
    "mode": "single_turn",
    "turns": [
      {
        "role": "user",
        "text": "standard plan",
        "lang": "en"
      },
      {
        "role": "user",
        "text": "standard plan",
        "lang": "en"
      },
      {
        "role": "user",
        "text": "treatment plan",
        "lang": "en"
      }
    ],
    "ui_counterpart": null,
    "budget": {
      "wall_clock_s": 60,
      "turns": 1,
      "tool_calls": 6
    },
    "allowed_intermediates": [],
    "audit_required": false,
    "n_runs": 5
  },
  "oracle": {
    "kind": "program",
    "check": "retrieval_at_k",
    "constraint_class": "postcondition",
    "expect": null,
    "tolerance": null,
    "assist_only": false,
    "independent_check": true,
    "evidence_keys": [],
    "gold": null
  },
  "scoring": {
    "primary_metric": "retrieval_at_k_pass",
    "gate_refs": [],
    "weight": 1.0,
    "difficulty_target": "medium"
  },
  "anti_gaming": {
    "paraphrase_group": "SKILLS-MD-029-P01",
    "hidden": false,
    "generation_seed": 9339,
    "canary_class": null,
    "behavioral_probes": [
      "paraphrase"
    ],
    "contrast_family_id": "L/markdown_loader/expression"
  },
  "provenance": {
    "source": "audit_derived",
    "derived_from": "skills/markdown_loader.py:132-138,167-177 (find_by_trigger / find_skill_for_request max matching triggers)",
    "guideline_ref": null,
    "reviewers": [
      "auto"
    ],
    "authored_on": "2026-10-01",
    "deprecated": null
  }
}
