{
  "schema_version": "1.0",
  "id": "RTOOL-CORE-027",
  "track": "B",
  "layers": [
    "L3",
    "L4",
    "L5"
  ],
  "comparability": [
    "alpha",
    "beta",
    "gamma"
  ],
  "construct": "core_postcondition",
  "cost_class": "state_only",
  "power_role": "primary",
  "clinical_intent": "The runtime-core terminal state must satisfy the postconditions.",
  "fixture": {
    "case_family": "synth/prostate_s02_full_pipeline",
    "setup_script": "fixtures/setup/prostate_s02_full_pipeline.py",
    "initial_state_hash": "sha256:38eabca0a6bcb5062deac0e5645e8bf52d9e5f51cdd0f137f824f4509461ada3"
  },
  "unit": {
    "kind": "task_scenario",
    "group_type": "G-CT",
    "contrast_family_id": "runtime/core/pred/guide_generated"
  },
  "protocol": {
    "mode": "single_turn",
    "turns": [
      {
        "role": "user",
        "text": "The runtime-core terminal state must satisfy the postconditions.",
        "lang": "en"
      }
    ],
    "ui_counterpart": null,
    "budget": {
      "wall_clock_s": 60,
      "turns": 1,
      "tool_calls": 6
    },
    "allowed_intermediates": [],
    "audit_required": false,
    "n_runs": 5
  },
  "oracle": {
    "kind": "program",
    "check": "pred",
    "constraint_class": "invariant",
    "expect": null,
    "tolerance": null,
    "assist_only": false,
    "independent_check": true,
    "evidence_keys": [],
    "gold": null,
    "persistence": "terminal",
    "predicate": "guide_generated"
  },
  "scoring": {
    "primary_metric": "pred_pass",
    "gate_refs": [],
    "weight": 1.0,
    "difficulty_target": "medium"
  },
  "anti_gaming": {
    "paraphrase_group": "RTOOL-CORE-027-P01",
    "hidden": false,
    "generation_seed": 2408,
    "canary_class": null,
    "behavioral_probes": [],
    "contrast_family_id": "runtime/core/pred/guide_generated"
  },
  "provenance": {
    "source": "audit_derived",
    "derived_from": "agent_runtime/core.py:68 (apply_ui_state_write); agent_runtime/core.py:152 (ToolRegistry); agent_runtime/core.py:308 (AgentMemory)",
    "guideline_ref": null,
    "reviewers": [
      "auto"
    ],
    "authored_on": "2026-10-01",
    "deprecated": null
  }
}
