{
  "schema_version": "1.0",
  "id": "SKILLS-TPL-014",
  "track": "A",
  "layers": [
    "L3",
    "L4"
  ],
  "comparability": [
    "alpha",
    "beta"
  ],
  "construct": "skill_template_trigger_match",
  "cost_class": "state_only",
  "power_role": "primary",
  "clinical_intent": "Skill template ['lung_full_workflow'] must be hit by the trigger word 'lung workflow'.",
  "fixture": {
    "case_family": "synth/prostate_s02",
    "setup_script": "fixtures/setup/prostate_s02_full_pipeline.py",
    "initial_state_hash": "sha256:38eabca0a6bcb5062deac0e5645e8bf52d9e5f51cdd0f137f824f4509461ada3"
  },
  "unit": {
    "kind": "task_scenario",
    "group_type": "G-CT",
    "contrast_family_id": "A/skill_templates/trigger_match"
  },
  "protocol": {
    "mode": "single_turn",
    "turns": [
      {
        "role": "user",
        "text": "lung workflow",
        "lang": "zh"
      }
    ],
    "ui_counterpart": null,
    "budget": {
      "wall_clock_s": 60,
      "turns": 1,
      "tool_calls": 6
    },
    "allowed_intermediates": [],
    "audit_required": false,
    "n_runs": 5
  },
  "oracle": {
    "kind": "program",
    "check": "retrieval_at_k",
    "constraint_class": "postcondition",
    "expect": null,
    "tolerance": null,
    "assist_only": false,
    "independent_check": true,
    "evidence_keys": [],
    "gold": null
  },
  "scoring": {
    "primary_metric": "retrieval_at_k_pass",
    "gate_refs": [],
    "weight": 1.0,
    "difficulty_target": "easy"
  },
  "anti_gaming": {
    "paraphrase_group": "SKILLS-TPL-014-P01",
    "hidden": false,
    "generation_seed": 9514,
    "canary_class": null,
    "behavioral_probes": [],
    "contrast_family_id": "A/skill_templates/trigger_match"
  },
  "provenance": {
    "source": "audit_derived",
    "derived_from": "skills/advanced_skills.py (Skill subclasses: name/category/triggers/tool_sequence/parameters)",
    "guideline_ref": null,
    "reviewers": [
      "auto"
    ],
    "authored_on": "2026-10-01",
    "deprecated": null
  }
}
