{
  "schema_version": "1.0",
  "id": "TRK-PAR-003",
  "track": "F",
  "layers": [
    "L3",
    "L4"
  ],
  "comparability": [
    "alpha",
    "beta"
  ],
  "construct": "nl_ui_parity",
  "cost_class": "state_only",
  "power_role": "primary",
  "clinical_intent": "NL and UI dual-path terminal states must match: ui.opacity.structure.",
  "fixture": {
    "case_family": "phantom/pancreas_p03",
    "setup_script": "fixtures/setup/pancreas_p03_pipeline.py",
    "initial_state_hash": "sha256:bb54b53f5ceec64b975a9a01c3b7c6d5e8293a7f3b940a64bc6d922c30607a7b"
  },
  "unit": {
    "kind": "task_scenario",
    "group_type": "G-CT",
    "contrast_family_id": "F/parity/opacity_structure"
  },
  "protocol": {
    "mode": "dual_path",
    "turns": [
      {
        "role": "user",
        "text": "Set the structure opacity to 60%",
        "lang": "en"
      }
    ],
    "ui_counterpart": [
      {
        "action": "set_opacity",
        "target": "structure",
        "value": 0.6
      }
    ],
    "budget": {
      "wall_clock_s": 60,
      "turns": 1,
      "tool_calls": 6
    },
    "allowed_intermediates": [],
    "audit_required": true,
    "n_runs": 5
  },
  "oracle": {
    "kind": "program",
    "check": "state_diff",
    "constraint_class": "postcondition",
    "expect": null,
    "tolerance": null,
    "assist_only": false,
    "independent_check": true,
    "evidence_keys": [],
    "gold": null
  },
  "scoring": {
    "primary_metric": "state_diff_pass",
    "gate_refs": [],
    "weight": 1.0,
    "difficulty_target": "medium"
  },
  "anti_gaming": {
    "paraphrase_group": "TRK-PAR-003-P01",
    "hidden": false,
    "generation_seed": 4409,
    "canary_class": null,
    "behavioral_probes": [],
    "contrast_family_id": "F/parity/opacity_structure"
  },
  "provenance": {
    "source": "audit_derived",
    "derived_from": "oracles/state_diff.py:36-107 (NL vs UI terminal state, M19)",
    "guideline_ref": null,
    "reviewers": [
      "auto"
    ],
    "authored_on": "2026-10-01",
    "deprecated": null
  }
}
