{
  "schema_version": "1.0",
  "id": "RTOOL-CONTRACTS-059",
  "track": "I",
  "layers": [
    "L3",
    "L4",
    "L5"
  ],
  "comparability": [
    "alpha",
    "beta",
    "gamma"
  ],
  "construct": "runtime_contract_paraphrase",
  "cost_class": "state_only",
  "power_role": "primary",
  "clinical_intent": "Different phrasings of the same runtime contract (run-state query) must land on the same decision.",
  "fixture": {
    "case_family": "synth/prostate_s02_full_pipeline",
    "setup_script": "fixtures/setup/prostate_s02_full_pipeline.py",
    "initial_state_hash": "sha256:38eabca0a6bcb5062deac0e5645e8bf52d9e5f51cdd0f137f824f4509461ada3"
  },
  "unit": {
    "kind": "task_scenario",
    "group_type": "G-EQ",
    "contrast_family_id": "runtime/contracts/paraphrase/run_state"
  },
  "protocol": {
    "mode": "single_turn",
    "turns": [
      {
        "role": "user",
        "text": "What is the current run status?",
        "lang": "en"
      }
    ],
    "ui_counterpart": null,
    "budget": {
      "wall_clock_s": 60,
      "turns": 1,
      "tool_calls": 6
    },
    "allowed_intermediates": [],
    "audit_required": false,
    "n_runs": 5
  },
  "oracle": {
    "kind": "program",
    "check": "paraphrase_invariance",
    "constraint_class": "none",
    "expect": null,
    "tolerance": null,
    "assist_only": false,
    "independent_check": true,
    "evidence_keys": [],
    "gold": null,
    "persistence": "terminal"
  },
  "scoring": {
    "primary_metric": "paraphrase_invariance_pass",
    "gate_refs": [],
    "weight": 1.0,
    "difficulty_target": "medium"
  },
  "anti_gaming": {
    "paraphrase_group": "RTOOL-CONTRACTS-059-P01",
    "hidden": false,
    "generation_seed": 2059,
    "canary_class": null,
    "behavioral_probes": [
      "paraphrase_flip"
    ],
    "contrast_family_id": "runtime/contracts/paraphrase/run_state"
  },
  "provenance": {
    "source": "audit_derived",
    "derived_from": "agent_runtime/contracts.py:91 (AgentRun.transition); agent_runtime/contracts.py:137 (RunLedger.transition)",
    "guideline_ref": null,
    "reviewers": [
      "auto"
    ],
    "authored_on": "2026-10-01",
    "deprecated": null
  }
}
