{
  "schema_version": "1.0",
  "id": "RT-SHORTCUT-032",
  "track": "F",
  "layers": [
    "L3",
    "L4",
    "L5"
  ],
  "comparability": [
    "alpha",
    "beta",
    "gamma"
  ],
  "construct": "shortcut_command_semantic_equivalence",
  "cost_class": "state_only",
  "power_role": "primary",
  "clinical_intent": "repeated/rephrased versions of the same whole command must yield the same shortcut decision (segmentation).",
  "fixture": {
    "case_family": "synth/prostate_s02_full_pipeline",
    "setup_script": "fixtures/setup/prostate_s02_full_pipeline.py",
    "initial_state_hash": "sha256:38eabca0a6bcb5062deac0e5645e8bf52d9e5f51cdd0f137f824f4509461ada3"
  },
  "unit": {
    "kind": "task_scenario",
    "group_type": "G-EQ",
    "contrast_family_id": "runtime/shortcut/semantic/segmentation"
  },
  "protocol": {
    "mode": "multi_turn",
    "turns": [
      {
        "role": "user",
        "text": "re-plan and generate the guide.",
        "lang": "en"
      }
    ],
    "ui_counterpart": null,
    "budget": {
      "wall_clock_s": 60,
      "turns": 1,
      "tool_calls": 6
    },
    "allowed_intermediates": [],
    "audit_required": false,
    "n_runs": 5
  },
  "oracle": {
    "kind": "program",
    "check": "semantic_equivalence",
    "constraint_class": "none",
    "expect": null,
    "tolerance": null,
    "assist_only": false,
    "independent_check": true,
    "evidence_keys": [],
    "gold": null,
    "persistence": "terminal"
  },
  "scoring": {
    "primary_metric": "semantic_equivalence_pass",
    "gate_refs": [],
    "weight": 1.0,
    "difficulty_target": "medium"
  },
  "anti_gaming": {
    "paraphrase_group": "RT-SHORTCUT-032-P01",
    "hidden": false,
    "generation_seed": 1291,
    "canary_class": null,
    "behavioral_probes": [
      "rerun_drift"
    ],
    "contrast_family_id": "runtime/shortcut/semantic/segmentation"
  },
  "provenance": {
    "source": "audit_derived",
    "derived_from": "agent_runtime/shortcut_contract.py:26 (explicit_segmentation_request)",
    "guideline_ref": null,
    "reviewers": [
      "auto"
    ],
    "authored_on": "2026-10-01",
    "deprecated": null
  }
}
