{
  "schema_version": "1.0",
  "id": "K-KNOWLEDGETOOLS-0014",
  "track": "K",
  "layers": [
    "L3"
  ],
  "comparability": [
    "alpha",
    "beta"
  ],
  "construct": "knowledge_tools.real_intent",
  "cost_class": "state_only",
  "power_role": "exploratory",
  "clinical_intent": "Save this plan as a case for future reference",
  "fixture": {
    "case_family": "legacy/knowledge_tools",
    "setup_script": "fixtures/setup/prostate_s02_full_pipeline.py",
    "initial_state_hash": "sha256:38eabca0a6bcb5062deac0e5645e8bf52d9e5f51cdd0f137f824f4509461ada3"
  },
  "unit": {
    "kind": "task_scenario",
    "group_type": "G-EQ",
    "contrast_family_id": "legacy/knowledge_tools"
  },
  "protocol": {
    "mode": "single_turn",
    "turns": [
      {
        "role": "user",
        "text": "Save this plan as a case for future reference",
        "lang": "en"
      }
    ],
    "ui_counterpart": null,
    "budget": {
      "wall_clock_s": 60,
      "turns": 1,
      "tool_calls": 6
    },
    "allowed_intermediates": [],
    "audit_required": false,
    "n_runs": 5
  },
  "oracle": {
    "kind": "program",
    "check": "retrieval_at_k",
    "constraint_class": "none",
    "expect": null,
    "tolerance": null,
    "assist_only": false,
    "independent_check": true,
    "evidence_keys": [],
    "gold": null
  },
  "scoring": {
    "primary_metric": "outcome_class_match",
    "gate_refs": [],
    "weight": 1.0,
    "difficulty_target": "medium"
  },
  "anti_gaming": {
    "paraphrase_group": "TPL-6c8682ff7f",
    "hidden": false,
    "generation_seed": 2026,
    "canary_class": null,
    "behavioral_probes": [
      "en"
    ],
    "contrast_family_id": "legacy/knowledge_tools"
  },
  "provenance": {
    "source": "legacy_migrated",
    "derived_from": "legacy:v2/09_knowledge_tools.json#KT014",
    "guideline_ref": null,
    "reviewers": [
      "auto-verifier"
    ],
    "authored_on": "2026-09-30",
    "deprecated": null
  }
}
