{
  "schema_version": "1.0",
  "id": "PLAN-DEV-039",
  "track": "A",
  "layers": [
    "L3",
    "L4"
  ],
  "comparability": [
    "alpha",
    "beta"
  ],
  "construct": "device_choice_cached_idempotent",
  "cost_class": "state_only",
  "power_role": "primary",
  "clinical_intent": "Repeated acquire by the same caller must reuse the cached device and must not change the preference.",
  "fixture": {
    "case_family": "synth/security_sandbox",
    "setup_script": "fixtures/setup/security_sandbox.py",
    "initial_state_hash": "sha256:d19d95b5118f88b7516fd18386d45a254cd79caee1cbd553cc51231f6c0acf90"
  },
  "unit": {
    "kind": "task_scenario",
    "group_type": "G-CT",
    "contrast_family_id": "plans/device_manager/cached_choice"
  },
  "protocol": {
    "mode": "single_turn",
    "turns": [
      {
        "role": "user",
        "text": "Repeated acquire by the same caller must reuse the cached device and must not change the preference.",
        "lang": "en"
      }
    ],
    "ui_counterpart": null,
    "budget": {
      "wall_clock_s": 60,
      "turns": 1,
      "tool_calls": 6
    },
    "allowed_intermediates": [],
    "audit_required": false,
    "n_runs": 5
  },
  "oracle": {
    "kind": "program",
    "check": "idempotency",
    "constraint_class": "postcondition",
    "expect": null,
    "tolerance": null,
    "assist_only": false,
    "independent_check": true,
    "evidence_keys": [],
    "gold": null
  },
  "scoring": {
    "primary_metric": "idempotency_pass",
    "gate_refs": [],
    "weight": 1.0,
    "difficulty_target": "medium"
  },
  "anti_gaming": {
    "paraphrase_group": "PLAN-DEV-039-P01",
    "hidden": false,
    "generation_seed": 7339,
    "canary_class": null,
    "behavioral_probes": [],
    "contrast_family_id": "plans/device_manager/cached_choice"
  },
  "provenance": {
    "source": "audit_derived",
    "derived_from": "plans/device_manager.py:328-366 preferred cache; oracles/recovery.py:180-214",
    "guideline_ref": null,
    "reviewers": [
      "auto"
    ],
    "authored_on": "2026-10-01",
    "deprecated": null
  }
}
