{
  "schema_version": "1.0",
  "id": "MEM2-PREF-012",
  "track": "K",
  "layers": [
    "L3",
    "L4"
  ],
  "comparability": [
    "alpha",
    "beta"
  ],
  "construct": "memory_write_idempotency",
  "cost_class": "state_only",
  "power_role": "primary",
  "clinical_intent": "memory:preference_store: Re-submitting the same memory write request must not change state other than receipts/version fences (lung, Rx=120.0 Gy, OAR=spinal_cord).",
  "fixture": {
    "case_family": "synth/memory_case",
    "setup_script": "fixtures/setup/memory_case.py",
    "initial_state_hash": "sha256:b5db22baf264552a1992522773785d1af6a75924b0dafc14fc2aa20a95a3f4ac"
  },
  "unit": {
    "kind": "task_scenario",
    "group_type": "G-CT",
    "contrast_family_id": "memory:preference_store/memory_write_idempotency"
  },
  "protocol": {
    "mode": "single_turn",
    "turns": [
      {
        "role": "user",
        "text": "Handle the lung memory task for case_lung_g01 (memory:preference_store).",
        "lang": "en"
      }
    ],
    "ui_counterpart": null,
    "budget": {
      "wall_clock_s": 60,
      "turns": 1,
      "tool_calls": 6
    },
    "allowed_intermediates": [],
    "audit_required": false,
    "n_runs": 5
  },
  "oracle": {
    "kind": "program",
    "check": "idempotency",
    "constraint_class": "postcondition",
    "expect": null,
    "tolerance": null,
    "assist_only": false,
    "independent_check": true,
    "evidence_keys": [],
    "gold": null
  },
  "scoring": {
    "primary_metric": "idempotency_pass",
    "gate_refs": [],
    "weight": 1.0,
    "difficulty_target": "medium"
  },
  "anti_gaming": {
    "paraphrase_group": "MEM2-PREF-012-P01",
    "hidden": false,
    "generation_seed": 2012,
    "canary_class": null,
    "behavioral_probes": [],
    "contrast_family_id": "memory:preference_store/memory_write_idempotency"
  },
  "provenance": {
    "source": "audit_derived",
    "derived_from": "memory/preference_store.py:77-171 (DESIGN §6.K)",
    "guideline_ref": null,
    "reviewers": [
      "auto"
    ],
    "authored_on": "2026-10-01",
    "deprecated": null
  }
}
