{
  "schema_version": "1.0",
  "id": "MEM2-SKILLLRN-031",
  "track": "K",
  "layers": [
    "L3",
    "L4"
  ],
  "comparability": [
    "alpha",
    "beta"
  ],
  "construct": "memory_op_preserves_plan_state",
  "cost_class": "state_only",
  "power_role": "primary",
  "clinical_intent": "memory:skill_learner: A memory operation, whether it fails or succeeds, must not corrupt plan/dose state (liver, Rx=120.0 Gy, OAR=stomach).",
  "fixture": {
    "case_family": "synth/memory_case",
    "setup_script": "fixtures/setup/memory_case.py",
    "initial_state_hash": "sha256:b5db22baf264552a1992522773785d1af6a75924b0dafc14fc2aa20a95a3f4ac"
  },
  "unit": {
    "kind": "task_scenario",
    "group_type": "G-CTX",
    "contrast_family_id": "memory:skill_learner/memory_op_preserves_plan_state"
  },
  "protocol": {
    "mode": "multi_turn",
    "turns": [
      {
        "role": "user",
        "text": "First load the memory for case_liver_l01 and confirm case isolation.",
        "lang": "en"
      },
      {
        "role": "assistant",
        "text": "Loaded; the isolation check passed.",
        "lang": "en"
      },
      {
        "role": "user",
        "text": "Then write the key planning points for liver back to memory.",
        "lang": "en"
      }
    ],
    "ui_counterpart": null,
    "budget": {
      "wall_clock_s": 60,
      "turns": 3,
      "tool_calls": 6
    },
    "allowed_intermediates": [],
    "audit_required": false,
    "n_runs": 5
  },
  "oracle": {
    "kind": "program",
    "check": "state_invariant",
    "constraint_class": "postcondition",
    "expect": null,
    "tolerance": null,
    "assist_only": false,
    "independent_check": true,
    "evidence_keys": [],
    "gold": null
  },
  "scoring": {
    "primary_metric": "state_invariant_pass",
    "gate_refs": [],
    "weight": 1.0,
    "difficulty_target": "medium"
  },
  "anti_gaming": {
    "paraphrase_group": "MEM2-SKILLLRN-031-P01",
    "hidden": false,
    "generation_seed": 2031,
    "canary_class": null,
    "behavioral_probes": [],
    "contrast_family_id": "memory:skill_learner/memory_op_preserves_plan_state"
  },
  "provenance": {
    "source": "audit_derived",
    "derived_from": "memory/skill_learner.py:82-151,236-254 (DESIGN §6.K)",
    "guideline_ref": null,
    "reviewers": [
      "auto"
    ],
    "authored_on": "2026-10-01",
    "deprecated": null
  }
}
